,emotion,labels_clean
44024,joyful,Lol cats are picky Here I have a bunch of animals so someone will always like it She wont leave her cage though and stays curled around her puppy all day and the blankets I have werent cutting it so she seems more comfortable now She is in a cage because she feels safer she was trying to bite other animals
44025,joyful,My dogs are just not picky And they never leave you alone lol I do have one dog that chews any dog bed or blanket though  Sigh Lab mix He is a handful and a half
44044,joyful,Thats neat  Where did you go
44045,joyful,Oh that sounds exciting  Ive never had the chance to go to one
44046,joyful,To Vancouver to see a drag show it was such a fun time
44074,excited,Youre gonna miss the launch What are you doing on here
44075,excited,Have you been playing for a long time
44076,excited,Ive been playing since 2006
44077,excited,I have it on my other screen Im ready It should be really fun
44078,excited,Yeah 4 years
44133,joyful,Mmmm I love gourmet ice cream  If I didnt have self control I would be like 800 pounds from it
44134,joyful,You and me both we need to hit the gym
44135,joyful,Ive definitely gained weight this summer from eating so much ice cream haha
44150,joyful,I love dogs what kind of puppy is it
44151,joyful,I have a pit myself they are great dogs despite what people say about them
44152,joyful,Pitbull mix Wont know until he is older  I didnt know if he would make it so its really sweet and happy to see
44153,joyful,People are the bad ones Dogs are fine 
44166,excited,Are you excited about it
44167,excited,Whats new in the game
44168,excited,Indeed I am
44169,excited,New races new places to go new story lines
44209,excited,lol I bet how old are they
44210,excited,Ohhh Those times are nice I only have a partner but I know I love my quiet mornings and my morning routine 
44211,excited,I have 6 year old and an 11 year old  Ill have the mornings to myself at last
44260,joyful,You must be so proud when did you find out
44261,joyful,Wow amazing Do you enjoy motherhood
44262,joyful,This was back before my first child about 12 years ago I am now a mother of five
44308,joyful,Who is coming
44309,joyful,Oh well that should be a lot of fun
44310,joyful,My aunts and uncles
44373,joyful,Congratulations What a wonderful achievement If I could do it all over again this is what Id want to do too
44374,joyful,Dont look back Go forth and be brave
44375,joyful,Thank you  Im so excited just to have the opportunity to go
44383,joyful,It sounds like you had a really good time
44384,joyful,Its always a good place to be when you are content
44385,joyful,It was nice and peaceful for sure
44400,excited,What is in Asheville
44401,excited,Oh that sounds very fun
44402,excited,A lot of cool breweries
44464,excited,I love to play videogames What did you play
44465,excited,That is a very good game
44466,excited,League of Legends its a popular game I can play with my friends
44492,excited,Thats how many cups of coffee I had this morning Did you have coffee too
44493,excited,Oh yeah that does start next month I guess I know what my husband will be doing on Sundays hahaha
44494,excited,Ha sorry about that I meant to say I am looking forward to next month I am excited about the NFL
44501,excited,Are you a big Eagles fan
44502,excited,Are you a big Eagles fan
44503,excited,I am excited for the next football season the Eagles could repeat who knows
44605,excited,Nice how much do you bench
44606,excited,I see  how many years have you been playing footballwhat kind of goals do you have
44607,excited,I am not sure I dont really bench a lot
44608,excited,What did you get in the mail
44609,excited,Thats so cool what is his name
44610,excited,a russian tortoise
44611,excited,whats the dogs name  what kind is it
44612,excited,oh those are nice loyal dogs
44613,excited,Its a big husky we havent named her yet but we like her
44635,excited,what did you see
44636,excited,i hear that movie is great
44637,excited,The new mission impossible
44638,excited,It was so good
44648,joyful,Thats great Good for you
44649,joyful,That must feel really good I bet your parents are proud
44650,joyful,Thank you Its baseball and I worked hard
44745,excited,What kind of job is it
44746,excited,That sounds like a good one
44747,excited,Its a financial analyst job The company is really good and its something new for me
44808,joyful,What will you do next
44809,joyful,Have you found a house yet
44810,joyful,im looking to rent a house now
44811,joyful,I have only been looking Nothing in my price range yet
44874,excited,Whats going on next week
44875,excited,Amen to that Mine start wednesday and Friday
44876,excited,kids go back to school
44921,joyful,What is that
44922,joyful,Oh nice I never got into those games
44923,joyful,World of warcraft
44970,joyful,Thats great Do you think the rest of the week will be as great
44971,joyful,Lucky you Are you always a positive person or its just been an amazing week really
44972,joyful,I hope so  It looks promising  
44973,joyful,haha  Kind of both  And also probably too much coffee to start my shift tonight
44974,excited,Oh yeah  I hope you did well
44975,excited,Good for you
44976,excited,I did amazing got a 95 so surprised
44977,excited,Are you excited to move out
44978,excited,Where is the house located
44979,excited,OH YEAH  We might put an offer in tomorrow
44980,joyful,You must be really glad to have them  Did they do something nice for you recentyl
44981,joyful,That is really great  Hold on to those good friends
44982,joyful,I did buy them gifts but still felt so nice to be appreciated
45092,excited,you should be
45093,excited,wow thats great
45094,excited,She just started school again nursing
45110,excited,What do you have planned
45111,excited,Thats going to be fun little catch and release
45112,excited,Taking the kids to the lake and going fishing
45113,excited,Depends on the size  The younger kids like to run around and play with the geese lol
45120,excited,The week just started ha ha  Do you have some fun plans
45121,excited,Awesome my brotherinlaw does that  He loves it  Hope its beautiful weather for you
45122,excited,yea i want to go fly fishing
45141,excited,Well you are supposed to tell me about something that made you feel a certain way  Please share
45142,excited,Thats great  Having a job is a big deal  and Im sure it was a blessing after not having one for three years  Congrats to you
45143,excited,o ok  it was about this job i got it was the best and it made me feel good about my self it was my first job in 3 years
45144,excited,thanks it was a big deal for me because raising my baby is a big job
45248,excited,thats cool what kind of car are you getting
45249,excited,oh wow
45250,excited,It is a special edition Porsche  It is a dream car
45306,excited,thats a nice birthday gift
45307,excited,take tons of pictures
45308,excited,He will be over the moon and I am probably going to be happier to see his face than he will be about getting it
45309,excited,I love puppies what kind did you get 
45310,excited,I never seen a husky with blue eyes I know it is beautiful great addition to the family 
45311,excited,Its a small husky with huge blue eyes
45388,joyful,Really What is your favorite ice cream
45389,joyful,Those sounds delicious I should go get some before the summer ends
45390,joyful,I love malted chocolate or anything with caramel
45423,excited,I hear you are you getting the day off of work
45424,excited,That sounds awesome  Where are you going
45425,excited,Yes and I am headed out of town
45426,joyful,Is that good or bad
45427,joyful,Good enjoy it when you get it that is what I say
45428,joyful,Good to have occasionally I love to have it 
45505,joyful,aww that sounds adorable Is he getting to big boy age
45506,joyful,hahaha oh no The adventures of being a parent lol
45507,joyful,He will be 3 in January and Im trying to combine potty training with this so he feels like a big boy and will start acting like it Lol
45528,excited,Dang Ask her out
45529,excited,Alright alright you can go the slow route
45530,excited,hahaha I think we should get to know each other for more than one day first 
45613,excited,Thats really good Is he very smart
45614,excited,I wish the best for your son I am sure he will do well wherever he goes
45615,excited,He is I hope they let him start 
45616,excited,Thanks so much
45652,joyful,What kind of cancer
45653,joyful,You gotta have some faith
45654,joyful,Blood cancer am afraid i will loose him
45661,excited,Me either Do you have any plans
45662,excited,Thats sounds like a blast Ive never been courageous enough to attempt that
45663,excited,Yes Im going tubing down some rapids  I love doing it every year and its supposed to me sunny and clear
45689,joyful,Thats great what job is it
45690,joyful,I have never met someone who has done that for a job
45691,joyful,I am going to be a birthday clown
45732,excited,Awesome What are your vacation plans
45733,excited,Oh man Im jealous Have fun and dont forget to wear sunscreen
45734,excited,Heading to the beach  I havent been to the beach in years and now we are headed out for 2 weeks
45845,excited,Congrats That is great news
45846,excited,I bet You deserve to be proud and excited though You have worked hard for this
45847,excited,Indeed it is i couldnt hide my excitement in the office lol
45948,excited,Oooh free from what
45949,excited,Wow thats awesome To the beach
45950,excited,lol  Going on vacation to Florida in a couple weeks
45951,excited,Heck yeah  Havent been in 2 years  Need a break
45952,joyful,Congratulations Do you feel relieved to be done with school
45953,joyful,What did you study
45954,joyful,I do Now the tough job hunt beginsand the mountain of student loan payments
45955,excited,Awesome So youd recommend it if I were looking for a new phone
45956,excited,Ive never been a phone of Apple anyway I had the first iPhone and wasnt impressed so I never tried again
45957,excited,Indeed For 700 this phone is above expectations Latest iPhone versions are becoming so overrated with inflated prices
46077,excited,What kind of website are you planning on designing
46078,excited,Nice Perhaps I can go buy a car on the website one day
46079,excited,Our company landed a big deal with a local car dealership  So it should be a fun project
46080,joyful,Holy cow thats amazing  Thats awesome of you
46081,joyful,Thats the coolest thing Ive heard all day
46082,joyful,They paid for my college all the way through and I always wanted to do something to pay them back
46099,joyful,Same my friend France played so well
46100,joyful,I do hope you rubbed it into your coworkers faces like I did
46101,joyful,yeah i had smirk on face for couple of days I never felt so joyful going into office
46102,excited,ah happy birthday in advance to you And whats the plan
46103,excited,They definitely will get you a rum cake
46104,excited,Thanks I am just going to a bar with some close friends I do hope they get me a cake
46123,excited,Did you just clean your place
46124,excited,Mmmm I love that brownie smell  Also nothing better than fresh brownies
46125,excited,No  Ive got brownies in the oven
46126,excited,Thats right  I cant wait until theyre done
46191,excited,Thats awesome What type of work will you be doing
46192,excited,Hope you enjoy it
46193,excited,Im going to be a fry cook at McDonalds I cant wait to be raking in the big bucks
46304,joyful,ok
46305,joyful,ok carry on
46306,joyful,I am so happy to see her
46326,excited,That is awesome Do you think you are prepared
46327,excited,Well that sounds like you have prepared for sure Hope all goes well
46328,excited,Yeah definitely prepared  Ive been working on this idea for 3 months
46356,excited,Wow that must have made you feel so good about yourself
46357,excited,Its such a great joy to win something I hope your luck continues
46358,excited,Considering I never win it made it even more awesome yes
46372,excited,Nice I love donuts Are you going to go there as soon as they open
46373,excited,I havent had any in a while but now I suddenly want some
46374,excited,Yes I cant wait to get some
46428,excited,Awesome Have you been looking forward to it
46429,excited,Great I hope you have fun and remember it for a long time
46430,excited,Yes  I cant wait to go
46431,excited,Thank you for the kind words
46450,excited,That must be a relief
46451,excited,I hope you get a fresh start elsewhere
46452,excited,It was very much so I put up with them for a year terrible pay constantly changing rules They said they were going to promote me but didnt
46493,excited,That is awesome How was the rest of the show
46494,excited,Whoa that sounds incredible You are very lucky to have witnessed that
46495,excited,It was fantastic He belted out every song with power Sounded very good for his age He did Fly Me to The Moon without a mic at the end
46496,excited,Yes It was an experience of a lifetime He still has concerts scheduled for later this year as well
46555,joyful,Well hey happy early birthday Im happy you take a positive spin on it I wish I could do that myself I hate mine always dread when it comes Makes me feel like I havent achieved what I would have liked to have achieved at the age Im turning to so I just get selfconscious about it
46556,joyful,Thats good advice I will try to In general I dont like talking about myself or having attention put on me so thats partly the reason birthdays arent my thing either But its good to have people who like theirs
46557,joyful,Thank you I think you need to be a little easier on yourself No ones life is perfect or just as they want it but we need to make the most out of what we have
46567,excited,Wow how did you afford that
46568,excited,Awesome I hope it is all worth it
46569,excited,I budgeted for a year to make sure I could afford it Well worth it
46570,excited,Haha every character ever right I bet that will be fun
46571,excited,Yup I heard its all of them and it will be the biggest smash ever
46572,excited,It sure will be I am super excited for it plus they will add more characters I am sure
46660,excited,That is great I have never been fishing before
46661,excited,I wil give it a shot some time then
46662,excited,Its pretty relaxing It doesnt require much out of you so if you enjoy being out with nature and getting something good to eat while youre doing it its a fun time
46663,joyful,Its amazingthe rich just think we dont have bills and needs right
46664,joyful,Are you moving in too another apartment or a house
46665,joyful,Haha thats for sure They always wait until the last possible moment allowed by law if there is one At least now I can put down on a new palce
46666,joyful,I think its going to be another apartment I lead kind of a small life
46671,excited,Me to I love the weather in fall are you ready for fall because summer is so hot
46672,excited,Yes the colors are so beautiful in the fall and I love the fashion look as well lets cheer to fall almost being here lol
46673,excited,Yes and Im looking forward to the changing colors and cool breezes
46738,joyful,Thats incredible How old
46739,joyful,What great ages
46740,joyful,10 and 13 years old
46747,excited,That is awesome I love water parks Do you like pools in general
46748,excited,Oh yeah It is cool here today but it has been insanely hot Pools are the best
46749,excited,Oh yeah I love to swim Especially when its so dang hot outside
46778,excited,Oh how exciting
46779,excited,I bet it will be a great time and fun
46780,excited,I have never been before I hope its everything I dreamed it to be
46807,excited,Congratulations what type of work will you be doing 
46808,excited,You will be awesome glad it is something you are exciting about doing good luck
46809,excited,data entry work in an office setting its going to be great i cant wait 
46834,joyful,Do you normally have to work on weekends What did you do 
46835,joyful,Sounds like fun glad you got to do enjoy yourself 
46836,joyful,yea i do i wanted to go fly fishing
46893,joyful,Weekends off are always great  What did you do with your time
46894,joyful,Sounds fun  I hope you had a good time
46895,joyful,went to the coast
46905,excited,I love the feeling a rollercoaster gives Have you gone before
46906,excited,Yes the juice is certainly worth the squeeze
46907,excited,Not to this specific one but Ive ridden some before None that will be as big as the ones at this park though Im a little intimidated The anxiety that you feel while you wait in line always gets me But the high you get afterwards seems worth it
46944,excited,I just love Fall Im guessing thats your favorite season
46945,excited,I feel you Watching the leaves change colors makes me feel peaceful
46946,excited,It is I long for it all summer
46984,joyful,Thats wonderful Always nice to take some time for the self especially with PTO
46985,joyful,Make sure to enjoy it to the fullest
46986,joyful,you got that right
46992,excited,Leaving family at home
46993,excited,Behave on your vacation 
46994,excited,Im single so My extended family isnt coming with me but Ive got no wife or kids to leave behind
46995,excited,I always behave mostly
47020,excited,Very nice I am sure you deserve it
47021,excited,Good for you Buy yourself something special
47022,excited,thank you i cant wait to spend the bonus So excited
47080,excited,What field are you in
47081,excited,That is awesome I hope it goes well
47082,excited,It is the field of technology
47083,excited,Thank you
47156,joyful,That sounds nice how long has it been
47157,joyful,It will feel like old times for sure
47158,joyful,It is been ages since we see each other  I hope Im not that changed
47162,joyful,Congratulations You must be very proud of her What kind of recital was it
47163,joyful,I bet It takes quite a level of talent and composure to perform publicly like that Kudos to your daughter
47164,joyful,It was a dance recital I am so happy
47194,excited,I bet thats super awesome Is it really comfortable 
47195,excited,Oh man I would fall asleep in that
47196,excited,Its crazy comfortable It has a power headrest so I can adjust it to fit me perfectly
47232,joyful,I used to be that way because I love holidays and the mood it puts everyone in But Im starting to hate how short the fall and winter days are and how quickly it gets dark Now that Ive been exercising outside more lately I hate losing that time in the sun
47233,joyful,I can understand that And I live in the south so it doesnt get that cold so I cant really complain I visited my girlfriend who lives in the midwest last winter and it got under 0 at times I could not live like that long term
47234,joyful,I like the summer some but really love the fall and winter
47311,joyful,That sounds so nice I love to be with my dog outside too even if just watching him play
47312,joyful,Yesv and a good exercise too
47313,joyful,yes playing with them is such a good time
47415,excited,Oh man I would be so excited When do you go
47416,excited,Man thats going to be so awesome 
47417,excited,In October I have been waiting so long I cant wait
47445,excited,Thats awesome What band is it
47446,excited,Never heard of it I hope it was a good show
47447,excited,Postmodern Jukebox
47466,joyful,thats great congrats Im glad to hear that you deserved it
47467,joyful,you should go celebrate with your other half and your friends
47468,joyful,Yeah Im so happy
47502,excited,Thats really cool What is your idea
47503,excited,That sounds like a really cool idea I hope that it turns out well
47504,excited,It involves splitting up some freelancing work and maximizing productivity
47539,joyful,Wow thats really lucky of you  Its good to find nice people out there
47540,joyful,Good thing you found that guy and not someone else
47541,joyful,It is That has never happened to me before
47567,excited,Oh I love vacations Do you love the water
47568,excited,Its beautiful Im sure youll have tons of fun
47569,excited,I do I cant wait to see the ocean
47683,excited,Oh nice Any big plans for it
47684,excited,Thats awesome The beach is always a good time especially when the weather is nice
47685,excited,Yea we are going to the beach All my friends are going too Its going to be a blast
47708,excited,Wow that must be exciting Do you have everything prepared
47709,excited,Nice Make sure to take lots of photos and make some cool memories together
47710,excited,I sure do I am going with a friend so its going to be really fun
47742,excited,What games did you liked
47743,excited,I like a lot COD It is one of my favorites
47744,excited,I played a lot of COD
47748,excited,That sounds awesome I wish I could go
47749,excited,That sounds like a really good time It will be like you are a kid again
47750,excited,Yeah I havent been since I was very young so I feel like its my first time all over again
47760,excited,Whoa congrats You must be very excited
47761,excited,That is so awesome Im sure it will be a very fun day to share with everyone
47762,excited,I am  It cant come fast enough  Im hoping for great weather since itll be outside
47839,joyful,Thats awesome what kind of car is it
47840,joyful,have you always wanted a jeep they seem pretty fun to drive
47841,joyful,It is Jeep Wrangler X Series
47874,excited,Now thats quite a gift Are you going to take her to any games as a thank you
47875,excited,Ive been looking forward to it starting too Not a lot going on at the moment But thats wonderful to hear
47876,excited,Oh yeah I definitely want her to join me Weve gone to a lot of tailgate events too Going to be a great football season
48024,excited,Oh who are they playing
48025,excited,That will be so fun
48026,excited,They are playing Tampa Bay
48086,joyful,Thats nice How are you gonna spend your weekend
48087,joyful,Oh man good luck Hope you roll high
48088,joyful,going to vegas
48118,excited,Oh sweet What number tattoo is it
48119,excited,Thats pretty awesome What is it gonna be of
48120,excited,Its going to be my 6th tattoo overall
48124,joyful,Thats great to hear Are you usually really busy
48125,joyful,Thats crazy Well I hope you have an awesome weekend
48126,joyful,yea the work just keeps coming
48146,excited,Oooh that sounds fun What are you planning on shopping for
48147,excited,Oh what a coincidence I moved into a new apartment as well You need more stuff than youd think
48148,excited,Home stuff for my new apartment
48158,excited,Leg day Never heard of that Do explain
48159,excited,Oh yeah now I get it Hope you get a good workout in
48160,excited,The gym
48161,excited,Ive been eating Mexican food almost every day
48162,excited,Nope still love it haha
48163,excited,hahaha were like two extremes then Are you getting sick of it
48164,excited,Oh nice What are you gonna do with that money
48165,excited,Dude youre gonna feel a lot of relief paying it off
48166,excited,Pay off all my debthaha sadly
48204,excited,Me too What do you have planned
48205,excited,Cool I live near the coast Great time to go there
48206,excited,gonna go to the coast 
48225,excited,oh thats awesome
48226,excited,keep it up
48227,excited,Yeah Ive never been able to lose weight this well and Ive tried so many things  
48283,excited,That sounds awesome were are you going if you dont mind
48284,excited,Nice The summer is the perfect time for the beach
48285,excited,Im going to the beach with friends Its going to be incredible
48323,excited,Oh yeah baby that sounds awesome I dont know what it is but those buy in bulk stores food cafes always have INSANE pizza Im jealous
48324,excited,Believe me Ive eaten my fair share of it My stepmom used to take me and my brother there when we were younger Ill always have fond memories of it But youre right I do need to go back and get some more sometime
48325,excited,Yea The pizza is pretty large for what you get for 10 You need to try it out sometime
48329,excited,Oh wow How many have they had now lol
48330,excited,Oh not that much really
48331,excited,Lets see 64 Melee Brawl Smash 4 so I guess this will be the 5th
48423,excited,wow a cruise sounds pretty amazing where to
48424,excited,Oh man Youll get to spend time with the family too thats whats up
48425,excited,It is going to the Western Caribbean The best part is my whole family is meeting on the ship We are going to have a blast
48515,excited,That is so exciting  Is this your first
48516,excited,I guess you have a plan to induce labor or a scheduled Csection
48517,excited,yes it is  im am very nervous and excited 
48533,joyful,Thats great
48534,joyful,I know how that feels Its a good feeling to be on the right path finally
48535,joyful,We hit a rough patch things are looking brighter
48582,excited,Whats your favorite Mexican sweet
48583,excited,I have never had any either I hope you enjoy them
48584,excited,I dont know yet Itll be my first time trying them
48585,excited,Thats pretty nice I havent been skating in a coons age Is the rink nice
48586,excited,Thats great I may look it up and go to their grand opening as well
48587,excited,So far it looks pretty nice
48603,excited,Thats great Where are yall from
48604,excited,I visited once there The people are very nice
48605,excited,We are from northwest Louisiana
48627,excited,I havent but I am familiar with it
48628,excited,What team does he play for
48629,excited,Gareth Bale played his best and I was thrilled after watching him
48690,excited,That sounds exciting The seminar will be a great time to connect with your bosses
48691,excited,Great Im so happy that your hard work was worth it
48692,excited,yeah indeed years of hard work paid off and am so excited
