,emotion,labels_clean
21,joyful,Sounds great So whats your major
22,joyful,Well pleased You should be having brainsmanThats a tough coursei hear
23,joyful,It is computer science I am very happy of this achievement and my family is very proud
56,excited,I saw that game They won on penalty kicks
57,excited,It was very tense The other game with England and Sweden was not nearly as nervewracking
58,excited,Yes Both countries were not about to let each other win
59,excited,Youre right I prefer nervewrecking matches When both teams are great the tension really builds
78,joyful,What kind of house are you building 
79,joyful,That sounds great What are you most excited for 
80,joyful,I just moved in so it is already built Just working on planning out decorating and appliances and such
81,joyful,I think I am most excited for all the space I have I can have friends over and not feel cramped
148,excited,I bet That sounds like fun
149,excited,What sweet memories to hold on to
150,excited,It was fun for sure all the rides and the food it brings back great memories
151,excited,Have you ever been to the amusement park
152,excited,Thats awesome How helpful where the other people so that you could enjoy your trip
153,excited,Must have been super fun How were the local people How did they treat you
154,excited,Thats great Im glad that they took care of you Have a gret day
155,excited,My wife was amazing She booked the whole trip for us and planned out some things for us to do while we were there The persons house we stayed at was also really great and helped us find our way around Auckland
156,excited,Super nice the locals were always willing to help us navigate around and had great recommendations for things to try while we were there
210,joyful,Thats so special What a beautiful moment How old is she 
211,joyful,My daughter is 15 years old  shes just been introduced to the water its always so special when our babies have their first moments Congrats mama 
212,joyful,She is 4 She normally is completely fearless compared to my son who is afraid of everything Haha So I love that she has worked so hard to overcome this
213,joyful,Thank you and same to you I hope you enjoy many happy swimming days with your little princess 
273,excited,What was it Ive been too busy to notice new movies out
274,excited,They do put out good movies most of the time I will try and check it out 
275,excited,It was called Infinity War You should find time to see it
276,excited,I think the new villain Thanos might be my favorite bad guy ever
292,excited,That is nice I like going to water park What time are you going
293,excited,Is it a big water park
294,excited,Its so much fun really pretty down there too Oh in a few hours 
344,excited,HAPPY BIRTHDAY Do you have any plans for today
345,excited,That is really cool Where did you guys on your trip
346,excited,I live in Texas so that it really close to me
347,excited,Still recovering from a road trip but hopefully things will get exciting this weekend
348,excited,New Orleans IT was great
349,excited,Cool
437,joyful,Awesome Happy Birthday to you Where are you going 
438,joyful,That seriously sounds like the best birthday ever i hope you guys have an awesome time 
439,joyful,I think to a amusment park but im not sure
440,joyful,Thank you I hope you have a good dau
513,joyful,Oh I bet that was fun and interesting visiting another country too
514,joyful,I like to try different types of food from other places too Then try to make them later on
515,joyful,Yea It was nice learning about the culture there and people were really nice
520,excited,Awesome Where are you headed to 
521,excited,OMG That sounds amazing Its going to be epic I hope you have a great time 
522,excited,Japan Looking forward to the food
592,excited,Did you buy tickets or win them
593,excited,Yeah
594,excited,I bought them woulda been cool to win them though right lol 
595,excited,What game did they win
596,excited,Really I dont recall that at all I remember them choking I could be wrong
597,excited,The NFC championship
682,joyful,awww dont tell anyone but my son is my favorite child I have two girls also
683,joyful,How old is your son now
684,joyful,I wont tell anyone
714,excited,Nice Which one
715,excited,That should be fun
716,excited,Well they have one near my job My son a Jack really wants to go so I am taking him
717,excited,Yeah he has been talking about it all week long
752,joyful,I agree I love autumn
753,joyful,I love Memphis
754,joyful,It gets do hot in memphis My daughter is ready for school to start back anyway
755,joyful,Me too Been here all of my life
762,excited,Thats exciting Cabin sounds really cozy
763,excited,Shes a lucky lady
764,excited,Yeah we havent gone on a romantic vacation in over a year so Im really looking foward to it
798,excited,Thats great Where did you meet
799,excited,What did you eat
800,excited,We met yesterday at this restaurant and just had some good conversation ate some food and caught up with each others lives
801,excited,Some garlic bread some hot wings and a few slices of pizza
805,excited,Yes when does the season start
806,excited,Thats exciting whos your favorite team
807,excited,August Cant wait
828,excited,I am I like the Oilers whos your favorite team
829,excited,Nice I hope they do well this season
830,excited,I love the Leafs
873,joyful,Do you study
874,joyful,Thats good Where do you go
875,joyful,I do now I passed all of my classes last semester so I think Im back on track
876,joyful,University of Memphis
888,excited,I watch it sometimes It can be a little slow moving for my taste
889,excited,Are you from New York area Im a little farther south but I do like them for sure 
890,excited,I love the Yankees
946,joyful,That must have been a burden lifted for sure
947,joyful,That must have been a burden lifted for sure
948,joyful,It really was I was scared I would fail but I ended up passing all my classes and even doing well in most of them I was over joyed
1043,joyful,Thats great That time with the kids will really be worth it ultimately
1044,joyful,Yeah its a good thing that you have a lot of time for other more important things now
1045,joyful,Absolutely and the time taken to becmoe experts on home repair is rather large
1101,joyful,How exciting are you from France
1102,joyful,When did she move out there
1103,joyful,No I am not It is exciting It has been almost a year since I saw her
1149,excited,Well happy early birthday I hope you have a great day
1150,excited,I bet I hope you get everything you want
1151,excited,Thanks I cant wait for tomorrow for the party and the presents
1174,joyful,That sounds like fun What are you planning to do at the lake
1175,joyful,It will be a great escape from regular life right How often do you get to go
1176,joyful,Im planning to relax maybe even swim sit near the water I love swimming
1177,joyful,I havent been to the lake for like a year so its going to be a lot of fun Its definitely going to be an escape from the daily life
1182,excited,That sounds like fun Was it your first time at Universal 
1183,excited,I can imagine Were there any other memorable aspects of the visit 
1184,excited,Yes it was indeed my first time there even So that was even more exciting
1203,joyful,Thats awesome Is she better
1204,joyful,Thats scary How old is she
1205,joyful,Yes she is She having issues with her heart She needed a chirurgical operation
1216,joyful,Thats such a nice gift What are your main uses of it 
1217,joyful,Ive heard great things about Reddit but have never actually signed up myself
1218,joyful,Mainly Youtube I do some freelance work on it occasionally and Reddit Lots of Reddit 
1249,excited,Wow  that sounds really awesome I wish I could have gone there But surely not for work 
1250,excited,I wish you all the best pal  You will surely rock 
1251,excited,This is my first time going there I want to try my luck
1270,excited,Im not actually much of a soccer fan but the hype is hard to escape 
1271,excited,Yes Im aware but im a much bigger hockey fan 
1272,excited,The world is the biggest sports competition worldwide right after the Olympics
1273,excited,I do not like to watch hockeyYou cant see the puck
1288,excited,Holy smokes  thats unbelievable  I gave up on playing those scratch off games
1289,excited,How often do you play
1290,excited,I know I normally do not win so I could not believe it when I did
1385,excited,What did you and your friends do on that day
1386,excited,That does sound fun Was the food good
1387,excited,We went to a new restaurant none of us had ever been to It was fun
1394,joyful,That is exciting when your team wins have you always been a hockey fan
1395,joyful,That is awesome I am from Chicago so when the cubs won the world series I felt the same way 
1396,joyful,Yep since i was 3 Was a nice time the streets of DC flooded with people celebrating a championship finally for the team
1397,joyful,I bet always good when new life is born
1398,joyful,Oh that must be a handful for your parents
1399,joyful,Yes she is the first granddaughter in our family Every one was excited to finally have a girl after all boys 
1456,excited,You still remember what you got for it  It must have been memorable  What was it
1457,excited,Oh I know that feeling  My family was the same way and I still remember coming home after my last day of 6th grade and seeing that same SNES box sitting on my bed
1458,excited,It  sure was It was a Super Nintendo which was epic because we were very poor back then 
1470,excited,What battle What were you doing
1471,excited,Is that a video game
1472,excited,I was playing 1v1 Starcraft on the competitive ladder
1479,excited,That is great With who are you going
1480,excited,That is great
1481,excited,I went with a bunch of people from my school
1641,excited,Thats cool  Im still a Boston boylived in Lowell MA in 45th grade
1642,excited,No I want to though  Did you score tickets or something
1643,excited,That is cool Have you been to Fenway Park
1650,excited,I can relate  weve been in our house 18 years and have yet to do anything  What style are you doing it in
1651,excited,I bet you are having a blast  How long do you think the renovations will take until you are done
1652,excited,We are picking out stainless steel appliances white cabinets and quartz countertops Its so much fun to pick everything out
1702,excited,yes I love new gadgetsSpecially from the Apple store
1703,excited,I remember also playing games with old and slow computers when i was a teenager
1704,excited,When i was a kid i had a dinky computer could barely run my games When i got a new one i was run down the halls screaming 60 FPS
1762,joyful,Good for youWhat is the reason of all this happiness
1763,joyful,You choose the best timeThe summer is perfect for beaches
1764,joyful,I am going to the beach this weekend
1791,excited,What are your plans
1792,excited,Wow that sounds like a fun and interesting time but it sounds like there are a high chance for things to go south and be a huge mess
1793,excited,My friend is having a drink and paint party Ive only been to one before but it was pretty fun I cant wait
1845,joyful,So I take it you are a soccer fan  It seems America is finally getting into the sport  Do you play yourself
1846,joyful,I would imagine so  Argentina seems like a lovely place to live
1847,joyful,I used to when I was a kid but not since then But I have to follow it I was born in Argentina its in my blood
1848,joyful,It really is And the food is amazing
1858,joyful,Ah congratulations What a GREAT feeling Are yall all still good friends
1859,joyful,You know what nothing to mourn really Life has chapters you know Its wonderful you have the memories you do
1860,joyful,Most of them yes things in life happen so I am not still in touch with all of them but oh well
1888,joyful,Sorry to hear about your other onesWhat breed is the new one
1889,joyful,Haha nice never a dull moment I bet
1890,joyful,Thank you Shes a jack russel and very spunky
1914,joyful,Cool want kind of music will the competition have
1915,joyful,That sounds like fun  I like all kinds of music too  What is your favorite
1916,joyful,All kinds I love getting to hear some new bands
2003,excited,Awesome What type of promotion Did you get a raise too
2004,excited,Congrats for what store or company Did you get a raise too
2005,excited,I WS promoted to the sales manager 
2006,excited,In an insurance company with a good pay check
2026,excited,What is happening on Sunday
2027,excited,Who are you pulling for 
2028,excited,Its always good to see an underdog win
2029,excited,The world cup finals the most important event in the planet
2030,excited,I want Croatia to win because they are the underdogs
2049,excited,thats pretty cool  what breed
2050,excited,Well you picked a great one  Love labs  My friends got a big one he just attacks me with love everytime I see him
2051,excited,It was a chocolate lab I didnt care what kind of dog I got I had always wanted one
2070,excited,I cant actually see what you put in the prompt but man thats crazy if it was a ferrari
2071,excited,I love Ferraris they are so expensive though one day I hope to own one
2072,excited,I said guess what A custom made Ferrari with luxurious taste 
2079,excited,Oh yeah Whats so special about it
2080,excited,Wow That sounds like such a fun time
2081,excited,I am going on my first cruise with my family
2082,excited,I cant wait It is going to be a great time
2096,excited,Oh thats sounds fun How much did it cost you 
2097,excited,Thats great Will you be camping in the mountains or a foresty place
2098,excited,Not near as much as we thought because we got an awesome deal
2099,excited,I bet that was really exciting
2100,excited,Oh wow that does sound exciting Are you still at this university
2101,excited,Yes it was I was ecstatic to go on a plane
2105,joyful,I can imagine it was a great experience not sure if I will ever have kids
2106,joyful,Defintely and im happy you went through with it after what I would assume was a long decision
2107,joyful,Its not for everyone I really respect people that give real thought to the decision It is a lifechanging commitment
2127,joyful,What are you feeling happy about
2128,joyful,Thats great Im sure you will enjoy being with them
2129,joyful,I get to see my kids next weekend
2236,joyful,I second that Ive been to all the parks a bunch of times
2237,joyful,Yea my little siblings love taking pictures with them
2238,joyful,I have an annual pass to the parks and I just love to go on the rides Meeting the characters is a plus as well
2267,excited,Ah that sounds like a good time Hope it doesnt rain for you guys
2268,excited,Yea the radars are usually accurate Cook good food for me
2269,excited,We are supposed to get some showers in the morning but thats it
2379,joyful,Congratulations You finally did it What is your occupation now
2380,joyful,That is a very noble that you have taken I wish you successful career with full of joy
2381,joyful,I am going to be a teacher at a high school for kids who have dropped out and went back to finish
2382,joyful,Thank you  I am very excited about it and glad I dont have to keep looking and looking and looking for a job
2478,joyful,Yes Theres nothing like the relief that comes with not having any assignments or projects due
2479,joyful,Ive never been on a cruise before Im too afraid of the open ocean Where are you going to go cruising
2480,joyful,I will be going on a cruise for the vacation
2505,excited,That is good I am so happy for you Where will your vacation hold 
2506,excited,I wish to be there too That has always been my dream place for vacation 
2507,excited,I am going to Clearwater Beach on the Gulf of Mexico  
2508,joyful,Happy for you Which course are you taking
2509,joyful,Wow you nailed it Sound like a tough course to study
2510,joyful,Physics calc and other normal filler courses or engineering classes
2514,excited,Really How did you win that
2515,excited,Thats great What do you write about
2516,excited,Well Let us just say i am good at what i do and i feel so good about it
2521,excited,Ive always wanted to go there What did you like most about it
2522,excited,I bet Im guessing it must be good weather then
2523,excited,The weather Its the same temperature and humidity everyday Makes packing easy
2524,excited,Oh yea Just above 70 with a light breeze
2543,excited,What makes your new living facility nicer
2544,excited,That is awesome Having more space is always a plus
2545,excited,Well the freshman dorms are old and small whereas the one that Im living in this year is brand new and closer to an apartment
2549,joyful,Wow thats amazing How did yall initially meet
2550,joyful,High school sweethearts thats so special Do you ever regret committing yourself to one person so soon
2551,joyful,Your outlook on love is really refreshing I wish you two the best with your new futures
2552,joyful,We met in high school when he moved in with a friend that was my neighbor We became friends just goofing around on the bus and then we got jobs at a neighborhood diner together and messaging each other every night and then eventually we just started spending every single evening with each other since 
2553,joyful,No not at all I feel so so lucky that I met him so young Ive grown up so much and become such a better person because he motivates me to do so and I am so lucky to get every year I can to spend with him 
2554,joyful,Thank you very much Im wishingpraying the best for you too 
2570,joyful,I bet you were thrilled Theres nothing like a hearty sandwich to conquer ones hunger
2571,joyful,I tend to pile my sandwich as high as I can and still fit it in my mouth I am like the Scooby Doo of sandwich doctors
2572,joyful,I was ecstatic Youre absolutely right especially when its hot
2617,excited,Thats crazy I couldnt imagine buying a car at 18 What kind of job did you have that you were able to do that
2618,excited,Thats a pretty great setup so soon in live Youre very fortunate
2619,excited,Yeah for sure Luck only gets you so far the rest is up to you 
2620,excited,You definitley had something to be proud of Not many 18 year olds can say they did that 
2621,excited,My dad has his own firm so I worked in the mail room and I also did stock trading on the side
2622,excited,That is what people say but I really worked hard and that car was a reward to myself
2623,excited,That is so true I can remember the smell of the interior of the car too and how my heart swelled up
2627,excited,Why do you have to stress so much to get black Friday sales 
2628,excited,Okay I think you need to find a better source of income so that you will not have to wait for black friday to get what you want 
2629,excited,Oh I wasnt stressed It was amazing to get the tv for a great price when I was really short on cash that year
2637,excited,Oh Its excellence Hope you enjoy your next year
2638,excited,yeah youre right Once youve moved there you started to love your city too
2639,excited,Yea i cant wait its nice being around a lot of people my normal city is pretty boring
2741,excited,aaawwww thats very impressive of him it must be a lucky day for you
2742,excited,wow thats good it is good you were patient too for him to pay back
2743,excited,Oh yeah I was considering getting a loan when i got my account credited I will have to call him now and thank him
2766,excited,I have never been to Chicago I heard deep dish pizza is incredible
2767,excited,Thats great to hear because I love food and pizza
2768,excited,Yes if you ever get the chance it is a great weekend getaway for foodies
2773,excited,Skydiving sounds like a lot of fun I need to go
2774,excited,I want to go so bad People that are afraid of heights are missing out
2775,excited,Its really great biggest thrill of my life
2812,joyful,That sounds fun What kind of job is it
2813,joyful,Oh thats fun teachers are some of the most underpaid people in the world
2814,joyful,Its a teaching job at a high school
2876,excited,Who is he to you
2877,excited,Wow when did you first meet him
2878,excited,An entertainer and a mentor
2879,excited,1984 I had won front row seats from a radio station so I had access to the stage 
2891,joyful,Wow you must be very brilliant
2892,joyful,For them to really give you that that means you got sharp brain
2893,joyful,Awww you are very sweet to say that I dont think I am I just applied to quite a number of schools and kept my fingers crossed
2894,joyful,Thank you for the kind words I cant tell how much of a dream this is for me
2930,excited,Wow that is a big decision Are you well prepared for the move
2931,excited,Moving can be both adventurous and a big headache You have to make big decisions about discarding many old possessions and selling your house if you have one
2932,excited,I think so I think it will be fun
2952,excited,Wooow thats nice You all will have fun together 
2953,excited,Yeah for sure  So where are they coming from 
2954,excited,Yes I think we will  We live near an amusement park and Im sure well go there one day
3040,joyful,Thats awesome I never won but I got close
3041,joyful,Thats good man there will be more trust me
3042,joyful,Yea im usually the same but I was happy i won for once
3053,joyful,What field is that
3054,joyful,Thats awesome What charity
3055,joyful,Fundraising for a charity
3056,joyful,One that helps children get a better education
3136,excited,Awesome where in Europe will you be visiting
3137,excited,Im jealous It will be amazing and I think youll have great fun there soaking up the culture and wine also I suppose
3138,excited,i am going to France and Italy
3148,excited,Yes me too  is that because of the gifts
3149,excited,Yes it was so exiting what about now do you receive many presents
3150,excited,Thats right I guess since I was a kid have always anticipated opening the gifts in the morning
3212,joyful,Wow that is so exciting 
3213,joyful,How sweet 
3214,joyful,Yes he was in summer camp for a month I cant wait to see him
3296,excited,I bet you were Who isnt
3297,excited,I couldnt wait to not wake up early Then I got a job lol
3298,excited,That is so true
3346,joyful,Wow now you have a brother that is good to know
3347,joyful,So how cute is he
3348,joyful,yes
3457,excited,Must have been a good result  Was it for a job school or for medical results
3458,excited,I am sure your family was proud of you as well
3459,excited,Yes I made excellent result
3534,joyful,Wow Was it a scratcher or did you have to pick numbers
3535,joyful,Wow Lucky you You should try it again
3536,joyful,I had to pick the numbers and I went random I felt pretty good the rest of the day after that
3537,excited,Cool Where are you going
3538,excited,Wow Have you been there before They have an amazing culture
3539,excited,Japan My work is financing some of it
3768,excited,I didnt go until I was thirty and it wa still fun
3769,excited,It is a great experience Expensive though
3770,excited,Anyone at any age can have a blast
3771,excited,Anyone at any age can have a blast
3790,joyful,Thats cool  How old are they now
3791,joyful,Wow that is quite a gapdo you still keep in touch with each of them
3792,joyful,16 18  19 and 41 Thats quite a gap But I also have 3 greats who are 19 21 and 24
3802,excited,You should be Chemistry is so hard
3803,excited,Do you find that you have a natural ability for it or do you have to study 
3804,excited,Yes I learned that in order to get a good grade in the class I had to put in the work 
3818,excited,How exciting for you Were you surprised
3819,excited,Sounds like it will be a lot of hard work to attend such a school but well worth it in the end
3820,excited,Kind of I didnt really expect to get in since the uni require amazing grades to get in and mine arent the best
3896,joyful,I sure do I moved into a dump lol
3897,joyful,Yeah it was nice It was a dump but it was my dump
3898,joyful,But dont you just feel that freedom you have You can do whatever you want with your place
3927,joyful,Dang Thats awesome Did you get any cool presents
3928,joyful,Wow thats really neat What kind of gift cards did you get Gift cards are always nice
3929,joyful,I really like whataburger  I think they have the most tastiest burgers What did you get from your family
3930,joyful,Ive been thinking about getting a nintendo switch for a long time now I used to play mario tennis on the n64 all the time
3931,joyful,Funny that you should mention that I actually did  I got a few gift cards from coworkers and my boss  i got a few things from my family as well
3932,joyful,I got one from chilis and one from whataburger its a regional burger chain  Gift cards are nice they always seem to come in handy
3933,joyful,I got a nintendo switch with the game mario aces tennis game  It all worked out well
3955,excited,I love going to concerts Who did you go see and where was the venue
3956,excited,Im a huge fan of casinos My favorite game is blackjack Whats yours
3957,excited,Just last week at one of the casinos It was a grand night
3958,excited,I like the slots Especially video poker
3959,joyful,That is great Some of the best romantic experiences are at school dances
3960,joyful,Sounds like you had a wonderful night I am sure she felt the same way
3961,joyful,Oh youre telling me When the first slow dance came on I thought my heart was going to burst
3968,excited,I recently got back from a trip abroad as well Traveling is a blast Where are you going
3969,excited,Dang now that sounds like a swell adventure Which one are you most excited to visit
3970,excited,I am visiting France Egypt Thailand India I having saving money for this for the last four years
