,emotion,labels_clean
13997,joyful,Excellent  Those thoughts are beautiful  Have a good day 
13998,joyful,I remember getting a Barbie doll that was the special holiday edition one It was pretty rare and hard to find but my grandma found it
13999,joyful,Oh yes I was smiling from ear to ear I hugged my grandma so tight that day
14004,excited,Oh I know that feeling I only just got my first decent smartphone this past year
14005,excited,Its definitely different than what I was used to Its crazy how fast technology upgrades Sometimes I feel like a caveman
14006,excited,It feels so good to updateupgrade doesnt it I feel like I have been out of the loop for too long
14030,excited,Ooh thats cool What did you have in mind 
14031,excited,Thats a good idea What restaurant were you thinkin 
14032,excited,I think Ill get everyone to wait at a restaurant and Ill tell him were going to dinner and all his friends will be there
14039,joyful,Oh really  Whats the good news
14040,joyful,Thats great  What finally convinved the boss
14041,joyful,Its good to get noticed for that  most of the time you only get attenton for messing up
14042,joyful,I have been pining for a promotion at my workplace and I finally got it this afternoon
14043,joyful,I think it was my streak of not making any mistakes over the last few months if nothing else haha
14141,excited,Congratulations Im sure its well deserved
14142,excited,How are you going to celebrate
14143,excited,Yes It is I am super excited 
14144,excited,A small party with my family You are also invited 
14178,joyful,Happy birthday to him What did he get 
14179,joyful,I bet those sound like awesome presents
14180,joyful,He got some awesome gifts like LEGO sets and color books He really is creative
14181,joyful,Its just so cool to see how happy children can be in their pure moments
14340,excited,Congrats I hope youll like what youre doing
14341,excited,Thats like the toughest job out there
14342,excited,Thank you  I do  I am a teacher  I cant wait
14417,joyful,Oh wow that is an awesome car
14418,joyful,i can imagine you would its an awesome situation
14419,joyful,I agree I was jumping up and down because I was so excited
14490,joyful,Congrats Boy or girl
14491,joyful,Im having a boy soon 3 months or so
14492,joyful,a Baby girl shes so stinking cute
14505,joyful,Thats great how much did you win
14506,joyful,Still more than you started with  For that ticket anyway  LOL  Congrats
14507,joyful,Thank you 50 Of course they take so much out in taxes
14508,excited,Oh that sounds like so much fun I love animals
14509,excited,Hopefully shell get more interested when she gets a bit older
14510,excited,Me too  But she didnt seem to care  She loved the Dinosaur ride  Its a rough one
14511,excited,I believe she will she loves her cats  
14565,joyful,i agree I love Fridays Did you have any plans
14566,joyful,Sounds like a great plan Also a great way to get diabetes 
14567,joyful,to get chocolate wasted
14597,joyful,what are you looking forward to
14598,joyful,Thats a great feeling I agree I rarely get a day where I just stay home
14599,joyful,being at home without having to do anything
14628,joyful,Congratulations Are you going by yourself 
14629,joyful,Have fun you two
14630,joyful,No Im taking my girlfriend with me I cant wait
14685,excited,oh happy for you buddy
14686,excited,how much did it cost
14687,excited,thanks I had to save up for ages
14710,excited,Its great when family get together Do you do that on special occasions only
14711,excited,Exactly You must feel very happy when that happens
14712,excited,Yeah Thats the period when every one seem less busy
14740,excited,That is nice You dont go anymore in family
14741,excited,Sorry to hear that It is good a idea
14742,excited,No unfortunately not because he has passed away but one of these summers I am going to take my family there on a vacation Start a new tradition  
14884,joyful,i love all the cardinals in the woods behind my house
14885,joyful,i dont want them to suffer either
14886,joyful,Arent they the prettiest I am an HSP and I just cant stand to see anything so innocent suffer
15012,excited,That sounds exciting  Where are you going
15013,excited,Ive had a lot of friends go there  What are your specific plans while youre away
15014,excited,We are going to Cozumel
15025,joyful,Wow Thats exciting Was it what you were looking for
15026,joyful,Thats great Congrats on your home purchase
15027,joyful,It was It is the perfect place on the outside of town
15028,joyful,Thank you
15146,joyful,Why are you happy
15147,joyful,Oh wow are you excited
15148,joyful,I just got the promotion of my life at work
15240,excited,Did you have a great Christmas then
15241,excited,Holidays are always a nice time to get together 
15242,excited,It was very nice
15353,excited,Whoa I hope you guys have a great honeymoon Make sure to treat your fiancee right
15354,excited,Well as long as you have a safe word you should be OK You also may want to buy some life insurance
15355,excited,Oh I will It isnt to hard to please a siberian tiger Ordering her from Russia was very difficult
15368,excited,It is very nice Where would you go first with your new car
15369,excited,Nice
15370,excited,I think I will go to McDonalds to buy 50 Big Macs to really infuse it with that nasty greasy smell of despair
15386,joyful,What kind of coffee will you get
15387,joyful,Are the coffees there expensive
15388,joyful,A large caramel frappe with whip cream Its delicious
15447,joyful,That is great You must be so proud
15448,joyful,That is nice that you are so supportive of her
15449,joyful,Her parents are pretty proud but Im more joyful for her than anything
15524,excited,I love cruises Where are you guys headed to on the cruise
15525,excited,Nice I think I went to Cozumel Mexico with my family in like 2013 It was on the Carnival Imagination cruise it was awesome
15526,excited,We are going to Cozumel We have never been on a cruise before We cant wait to go
15656,joyful,Thats nice
15657,joyful,Aw No one cooks for me 
15658,joyful,My wife had made a gorgeous spaghetti dinner and it was ready the moment I came home
15728,joyful,How old will you be
15729,joyful,Maybe they will party at your house after
15730,joyful,35 I wish I was having a party but Im going out with friends
15731,joyful,I have always wanted a surprise party I should have told them that lol
15839,joyful,Thats great What is he doing now
15840,joyful,Thats even more awesome I hope he does well
15841,joyful,He is preparing for college  I am so happy about it
15848,joyful,Thats great Ive never gotten a bonuse at work
15849,joyful,I just went on a vaction with my kids Its was so relaxing Have fun
15850,joyful,I am planning to use it for a trip with my family That will be great
15885,joyful,Oh cool  How pregnant are you
15886,joyful,Ohhhh so you already had her  Congratulations
15887,joyful,I had her 7 months ago
15916,excited,When does it come out
15917,excited,What is it about
15918,excited,Oct05
15948,excited,I love Tom Hardy
15949,excited,He is And he is nice to look at too lol
15950,excited,He is such a great actor
15994,excited,Congratulations Whats the job
15995,excited,Oooohhh Fancy lol
15996,excited,Computer Engineer 
16050,joyful,Yay What made you very happy
16051,joyful,Oh yeah I need to get my ass to a legal state to get my card too
16052,joyful,LOLOL  I got my medical marijuana card in the mail today
16076,joyful,Would you like me to take them  I like kids sometimes I totally understand needing a break
16077,joyful,Ah Nice lol Summer went by so fast Summer for parents now
16078,joyful,No school is starting lol
16085,joyful,That sounds like fun What kind of park is it
16086,joyful,Great Make sure to pack sunscreen Hot here where I am
16087,joyful,We are going to a really big park that is the kids favorite and we will have a picnic
16098,joyful,That sounds great  What do they like to do in the yard
16099,joyful,THat is so sweet  I hope the weather stays nice
16100,joyful,They love playing on their playground and swinging around their toy swords Slaying dragons and saving princesses
16220,excited,Its been a mix of a rollercoaster lol
16221,excited,Wow Are you going to stay now
16222,excited,I understand I would be too 
16223,excited,mine also  ive hated this job forever since they will never make me a full timer  and out the blue they offered me assistant manager
16224,excited,Honestly im just gonna take it for the experience and eventually quit im still salty it took this long for a promotion
16225,joyful,That is great what was wrong with the dog how was it abused 
16226,joyful,That is absolutely awful to hear poor dogs don not deserve to be mistreated in such ways  im happy the dogs better 
16227,joyful,She was starved and I dont know what else besides being bred and being quite young So starved she was quite aggressive about food at first and so tiredI could see her hip bones
16277,excited,Wow that doesnt happen very often Well done Those things are normally quite expensive arent they
16278,excited,Me too Clearance is the first place I head for in the store It must be so difficult to be gluten intolerant  seems as if theres gluten in everything these days
16279,excited,Something I found which helped me lots was to eat eg bread made from organic wheat So long as I dont overindulge Im fine  fingers crossed
16280,excited,Boy you are having a tough time Someone suggested buying imported pasta from Italy as the wheat doesnt have the same pesticides sprayed on it as us wheat Dunno if it works tho
16281,excited,YES I am intolerant of gluten and just want to die when I am on it so its always a good day when I can find cheap food that is also good for me I am easily pleased lol I love clearance stuff
16282,excited,Oh there is  I do eat it now and again but it seems to really screw up my weight loss and digestion so I try never to get near it They have great gluten free alternatives but yep they are all expensive 
16283,excited,Organic helps me a lot as well but unfortunately most things that are gluten free are NOT organic and I am so sensitive to pesticides Trying to find my way around that I am also on Keto low carbSo my diet is hard some days lol
16284,joyful,How long has it been
16285,joyful,Whoa SO needed What did you guys do
16286,joyful,It has probably been about 8 months are so
16290,excited,You were suppose to start the conversation with a situation based on the context chosen
16291,excited,I hope the hit will not be rejected
16292,excited,Im actually quite pumped for tonight  gonna bbq and watch the ufc fights
16293,excited,I hope the whole card is awesome gonna be some good fights tonight 
16323,joyful,That is nice Are you planning activities to do with them
16324,joyful,That is great
16325,joyful,Yes there is apparently a lot of free family activities locally
16454,joyful,I love Korean barbeque
16455,joyful,Is it open 24 hours a day
16456,joyful,Its some great stuff Thats why I used to travel for it lol
16504,excited,Going to a new restaurant is always fun  I am sure it will be great if there are a bunch of positive reviews
16505,excited,Yummmy  That sounds amazing  I am sure you will have fun
16506,excited,Im looking forward to it All the steaks lobsters and sides I can eat
16513,excited,Thats exciting  How did that go
16514,excited,Thats almost a little strange  Do you still have any interest in her
16515,excited,Pretty well Turns out shes never dated since and has been busy with grad school
16546,excited,I love dogs what kind
16547,excited,mutts are the most loveable
16548,excited,I think shes mixed
16552,excited,That sounds exciting  How long will you be staying
16553,excited,Thats cool Do you have everything planned out
16554,excited,Well be there for 4 days
16594,joyful,I bet that feels good
16595,joyful,It definitely does  You shouldnt have to stress about your job
16596,joyful,Yes Now I have a nice weekend Job problems can be heavy impact on my life
16649,excited,Neat Where are you going
16650,excited,Sweet What are you going to be doing there Always wanted to take a journey to the South
16651,excited,We are driving to Nashville
16708,excited,Are you scared or excited
16709,excited,My first few years I went from the east coast to Colorado It will be the best time of your life
16710,excited,Enjoy it before you get old Before you know it college will be over and you will be a slave to student loan payments
16711,excited,A little of both IT pretty far fom home
16712,excited,I hope so
16770,excited,Congratulations Yes it can be very hard to get pregnant and carry children for some I know how that goes
16771,excited,I do but both are in heaven But they are still my childrendoctorsmidwive mistakes on me in a lawsuit and so it affected the second one Not trying again until I can go to a specialized doctor and get in perfect health
16772,excited,Be very careful It was just an untreated UTI in me and then they wouldnt help me when I had HELLP syndrome for awhileI went to a few doctors toonone were goodand I was full termI almost bled outThe littlest things sometimes can really hurt you and your baby I am so sorry I am so glad you had 1 take good care of yourself and follow your gut 
16773,excited,Do you have children  Have you had trouble getting pregnant before
16774,excited,Oh no Im so sorry  I have had a similar experience with my second child that I lost  Dont give up  Im glad youre seeking justice  Im very wary of doctors myself
16866,joyful,That is very nice to friendly neighboors
16867,joyful,Yes Now days most neighbors dont talk to each other
16868,joyful,It is good to have people around that have your back
16894,joyful,That sounds like a jolly good time ole chap What showsmovies are you planning on watching
16895,joyful,Nice The Office is one of my favorite shows I do enjoy Steve Carrells character
16896,joyful,We will probably binge watch the office
16957,joyful,Thats really neat Did you guys have an easter egg hunt
16958,joyful,Thats cool Who collected the most eggs
16959,joyful,yes we did
16960,joyful,We had them all collect the same amount so it was fair for the littler ones
17059,excited,Oh cool  Do you play in the game or get to be the cooler part of the team the waterboy
17060,excited,Ha ha Awesome  I bet youre great at it  Get out a hose and just water them down Its faster  Hope you have a great game tomorrow  Dont forget the orange slices
17061,excited,I am the waterboy Cant wait to provide sweet succulent water to all the parched puckered throats
17101,excited,Oh yeah What is going to be your hallmark meal
17102,excited,Cant go wrong the sushi and steak special A classic in Alaska
17103,excited,Probably the sushi and steak special
17137,joyful,damn did you do it all alone or you had help are you lebron james living in a mansion
17138,joyful,ah thats understandable 
17139,joyful,My lawn is normal sized Its just that my mower kept stopping and going
17232,joyful,wow thats great
17233,joyful,every few years and its enough
17234,joyful,Thanks Yeah its hard having so many people in the house at one time since its so much frenetic activity But its worth it for a few days to make sure you stay in touch with family Do you have big family visits
17235,joyful,Yeah thats never something to complain aboutwell unless you were fired I guess but that doesnt sound like that was the case Im happy for you too Did you do anything fun with your extra time
17236,joyful,Well that was nice of you Im glad you got a chance to squeeze in more family time and didnt go spend it just sitting around or something I hope that happens more often for you
17237,joyful,took the kids out to peter piper pizza
17296,joyful,Thats amazing first child
17297,joyful,Cherish every moment they grow up SO fast
17298,joyful,It was  I didnt realize I would love a kid so much
17305,joyful,Oh I bet you enjoyed that
17306,joyful,I bet you will
17307,joyful,Yep Ill enjoy it greatly
17334,joyful,Does he live far away
17335,joyful,That makes sense Did you have fun
17336,joyful,He had just been busy with life and work
17337,excited,What movie is it
17338,excited,Well as long as they love it
17339,excited,SING for the 100th time My kids love that movie
17340,excited,Last day of summer vacation I can watch it once more
17341,excited,That sounds amazing   What do you have planned
17342,excited,That sounds great
17343,excited,We have so many activities planned scuba diving parasailing and relaxing I have been saving up for this for so long I cannot wait
17448,excited,Oh that could be tough sometimes Im glad you were able to get all the ones you wanted
17449,excited,Its all behind you now
17450,excited,Yep Last semester I wasnt so lucky
17451,excited,My neighbors are terrible so I hope you have a good relationship
17452,excited,I actually had some move in a couple of days ago I have figured them out yet lol
17453,excited,Oh Ive got terrible neighbors too I know that feeling I hope these are a lot better
17501,joyful,You must really miss him So glad youll finally be reunited with him
17502,joyful,Oh you have kids too Theyre going to be so happy
17503,joyful,I didimmensely  Its the hardest thing Ive ever endured with him leaving especially because I have to young kids  Were going to have a huge party
17504,excited,Ive never done that before
17505,excited,I bet its fun I cant swim though
17506,excited,Neither have I Im looking forward to it
17521,joyful,Oh man Costco pizza is great and so cheap too It may not be the best but for the price and quantity you cant really beat it Do you like shopping at Costco often
17522,joyful,Yeah I guess it depends on your household I just tag along with my parents from time to time to get certain things in bulk But I think you need to have a certain amount of people in your family for it to be worth the membership Still I really appreciate the business and the owner as a whole
17523,joyful,Not really I kinda feel like I dont get much but their food court stuff is great value for the money
17540,excited,Oh thats kind of nice Its nice to have those natural landmarks near where you live so you can visit them and get a sense of relaxation and peace Ive lived near the ocean all my life and while I do take it for granted from time to time I try to remember how useful and beautiful it is
17541,excited,Sometimes it means increased work commute or higher costs of living But sometimes that can be worth it in terms of the health benefits and lifestyle improvements that come along with it Its all a balance Im glad you seem to have found yours
17542,excited,Yea Im so used to living in the center of the city Nothing but cars and buildings I already feel so relaxed here
17543,joyful,that is awesome 
17544,joyful,It will save you a lot of money too
17545,joyful,Yea it is If Im ever tired of cooking I can always get pizza
17573,excited,Nice Are you excited
17574,excited,I hope its what you expected to be
17575,excited,I am so excited I got exactly what I wanted
17579,excited,Oh sweet Sin city What do you look forward to doing
17580,excited,Oh yea I heard the buffets there are amazing
17581,excited,Im looking forward to the dining and drinking  I cant wait
17585,joyful,That is great to hear  Anything in particular
17586,joyful,Cthat sounds amazing
17587,joyful,My vacations are coming and I am going to Italy with the family
17594,excited,Your husband sounds awesome Thats interesting that youre the type of person that actually likes birthday parties Most people I know would be too embarrassed or selfconscious to enjoy them and theyd feel uncomfortable Especially me But for you Im glad you can get into them 
17595,excited,Oh I didnt mean anything about the age Who cares about that Im just a doofus when it comes to social interaction so I get nervous and avoid things that put attention on me But I hope you have a lot of fun especially since your husband went through so much effort I bet he knows you and what you like well and it will be great
17596,excited,He is wonderful and ever though he isnt used to planning and putting bigger events together it sounds like he has it all ready  I do love them  I dont bother taking time to be ashamed of my age I embrace it with life Im turning 40 
17603,joyful,Oh thats rare How come
17604,joyful,Oh now I see lol Whos your favorite team
17605,joyful,I cant wait for football season
17606,joyful,Oh wow thats nice of you What kind
17607,joyful,I love BMWs They mustve been so happy
17608,joyful,It is a BMW  I am very happy about it
17612,excited,Are you exited about itDo you play the piano
17613,excited,Well there is your chance
17614,excited,Im super excited No I dont play I want to learn
17615,excited,Oh  yea Whats happening this weekend
17616,excited,Thats awesome How long are you guys going to be there
17617,excited,Me and some friends are going to Miami
17630,joyful,Thats great  What is the good news
17631,joyful,I am very happy for you
17632,joyful,I just found out my family will come to visit me soon I live quite far away so that made my day
17645,joyful,Thats awesome  Is she a good one
17646,joyful,I am really glad to hear that 
17647,joyful,She is amazing for him  I am so happy
17812,excited,I am so happy for you
17813,excited,Did you go on any rides
17814,excited,yea it was really fun
17857,joyful,oh thats so cool
17858,joyful,i bet you were so happy
17859,joyful,Yes it will be my first grandchild
17878,excited,When is she coming
17879,excited,How long is she staying
17880,excited,I was just talking to her She will be coming this month
17947,excited,Who invited you
17948,excited,Are you going to accept the invite
17949,excited,a friend
17971,excited,Im happy about that Got a party planned
17972,excited,You seem very excited I hope it turns out the way you want it to
17973,excited,Oh yes I have been planning it since before she was born
18053,excited,Oh cool What part of Texas were you going to check out
18054,excited,Yes the beaches there would be really fun to go explore Plus lots of sight seeing
18055,excited,south padre island seems like it will be cool
18107,joyful,Oh that sounds rough Were you successful
18108,joyful,Thats great Im happy for you I hope you get along real well
18109,joyful,Yes I finally found my biological mom and a sister We are about to meet for the first time and I am so excited 
18113,joyful,You must have been overjoyed I know what he meant to you
18114,joyful,Be sure and put it in a safe place
18115,joyful,Yea I was given it as a kid so I was happy to find it after all these years
18119,excited,Thats always good to hear Whats going on
18120,excited,That sounds like a fun time Enjoy
18121,excited,I will meet some good friends this week I havent seen in a while
18150,excited,who did
18151,excited,did you like what she bought
18152,excited,My wife
18153,excited,Its a lovely gift
18160,joyful,Aw thats adorable I bet hes the cutest thing
18161,joyful,Thats awesome I want a baby nephew 
18162,joyful,Yes its amazing how tiny and fragile little babies are He is growing so fast
18163,joyful,Hopefully youll be able to experience the happiness of a little nephew or niece
18183,excited,Wow that sounds like a lot of fun
18184,excited,What was your favorite part of the trip
18185,excited,It was indeed  I had never felt that happy before in my life
18309,excited,That is great What actor is it
18310,excited,That sounds like a great time I hope you have fun
18311,excited,Someone who I have watched perform in movies and on TV and never knew he could sing
18343,excited,wow me too we had fun
18344,excited,yeah it was fun too
18345,excited,Yeah its always a fun time of the year
18395,excited,Family time is a very important part of life
18396,excited,What did you have for Thanksgiving dinner
18397,excited,Yeah it always important
18416,joyful,That is so nice to hear How long have you been together
18417,joyful,That is a long time I wish the both of you well and excitement 
18418,joyful,We have been together for three years
18422,excited,It seems you were anticipating for a long time Which movie did you watch
18423,excited,I have heard its good Did you like it
18424,excited,It was the new mission impossible movie
18497,excited,That is such good news What did you get
18498,excited,Wonderful choice Those are very dependable and fun to drive
18499,excited,I bought a Honda Civic 2018 What do you think about the car
18551,excited,I am too it looks good
18552,excited,That has been fun
18553,excited,Yep I am excite after watching all the trailers and interviews 
18572,joyful,Aw really He is a great player anyways
18573,joyful,Hopefully he continues his streak at LA as well
18574,joyful,yea 
18602,excited,oh no what happened
18603,excited,Sorry to hear that my friend I hope things work out for you at work soon enough
18604,excited,too much work and i wasnt allowed to leave
18611,excited,oh cool buddy how much did you win
18612,excited,Alright anyways good for you
18613,excited,i cant disclose that 
18661,excited,Awesome  What are you all going to do there
18662,excited,That sounds awesome  Any beer drinking at the beach  Thats my favorite
18663,excited,As you know this summer is very hot we planned to spend the whole days in the beaches
18675,excited,Cool Are you going alone or with friends
18676,excited,Good for you To be honest i do not really enjoy attending live concerts
18677,excited,A big group of us from work got tickets real cheap Im super excited havent been to a concert in years
18684,excited,I bet Where are you going on vacation
18685,excited,Wow Hawaii sounds like a great place to vacay  I have never been there have you
