,emotion,labels_clean
28386,excited,Thats great  My daughter is 3 so I hope I can get her into a program like that
28387,excited,No  it is a free so that is another plus
28388,excited,My daughter is 3 as well Last year she was in Mothers Day out but it cost money and was only 2 days a week
28389,excited,Thats cool We saw it when it came out
28390,excited,It was exciting
28391,excited,I hate to ask but please tell me it was great
28454,joyful,Sounce like youre a bit of an introvert
28455,joyful,Yeah That gets old after a whle for me    
28456,joyful,Not exactly  Had 2 girls over yesterday and it was pretty fun lolall while ppl were messaging me on facebook
28463,joyful,Oh thats cool  Glad it worked out for her
28464,joyful,Boy or girl
28465,joyful,Yeah I think its great
28497,joyful,Absolutely Ive always noticed that phenomena If you act too desperate it actually puts them off On the contrary acting a little disinterested gets THEM more interested
28498,joyful,I can agree with that Women like a man who is dedicated to something It shows good characer
28499,joyful,Yup exactly but I feel like even acting disinterested can be pretty transparent since girls are super intuitivejust staying busy and being constantly on your grind turns them onfor me personally anyway how bout you
28514,excited,Oh awesome Thats crazy because my 30th birthday is next week lol What makes you excited Because Im dreading mine
28515,excited,Hahaha I guess thats true For me its pretty bad I dont know if youre familiar with the internet term but on my 30th birthday Im going to be a wizard lol
28516,excited,I feel like if I convince myself Im looking forward to it then I have no time to dread it
28517,excited,Ive always wanted one of those I hope you enjoy it
28518,excited,Ive tried some of the cheaper virtual reality headsets but Im sure they cant compare at all
28519,excited,I know I will  I am pumped up about this thing
28533,excited,Oh sweet I cant even  imagine the excitement you must have I hope everything works out for you
28534,excited,We need more musicians who are about the music and bringing enlightenment to people We got way too much commercial garbage on the radio I really hope your message resonates with people
28535,excited,Yes thank you
28604,joyful,Thats great You must be excited    Have you played all the smash bros games
28605,joyful,Thats pretty cool Ive never played it before What genre is it
28606,joyful,That sounds fun I might have to check it out  It sounds pretty nostalgic
28607,joyful,I wont have a switch but I think that may be worth checking out
28608,joyful,Yup The first one came out when I was in like middle school So its crazy finally getting a character you wanted in the game over 10 years later
28609,joyful,Its like a fighting game but some people call it a party game but basically its a fighting game with all kinds of Nintendo characters You have stuff like Mario Donkey Kong Link Zelda Pikachu etc etc So every time a new game comes out people post online about who they want to see in it next This new game is filled with characters and I think most people will be happy The first game came out in 1999 Time sure flies 
28610,joyful,For sure its definitely worth playing The first game was on the N64 the newest one is going to be on the Switch If you have a Wii U or 3DS theres a Smash game on each of those I love the game I used to play in tournaments with my friends
28852,excited,Yes My husband and I bought the old school Nintendo and played a couple of months back
28853,excited,They are I really enjoyed playing them We also played Donkey Kong
28854,excited,Those games still hold up their style is timeless such a commendable move
28871,excited,I do I used to play growing up
28872,excited,I will have to try it out
28873,excited,It is worth a look for the new one it looks awesome to me
28915,excited,That sounds really exciting what was it
28916,excited,Congratulations  Thats awesome  I hope you give him the world
28917,excited,I just adopted a son 
28990,joyful,I enjoy football but I mainly enjoy that when football happens fall comes
28991,joyful,What do you do for work
28992,joyful,That is true the only down side is my job gets busier
29033,joyful,I bet That is a special moment
29034,joyful,What did you name him
29035,joyful,Thats so cute I have a son named Ethan
29036,joyful,It really was like no other moment
29037,joyful,Knox
29060,joyful,Thats so nice
29061,joyful,Hey children are a miricle 
29062,joyful,I know I had them sort of late in life but theyre worth the wait
29198,excited,i bet your excited wish i was you
29199,excited,good for you send me a post card enjoy
29200,excited,I have been waiting for a long time I will have such a good time
29223,joyful,Thats awesome Math is pretty tough
29224,joyful,Glad all that studying worked out
29225,joyful,It is I studied a ton though It looks like it worked out
29275,joyful,I didnt know such a thing existed What store
29276,joyful,Oh Thats a nice program Well getting any amount of groceries for free is nice but yes too bad it wasnt a supermarket sweep
29277,joyful,Minas market Its local
29282,joyful,Was it Dominos pizza
29283,joyful,Because I love Dominos so thats the only pizza I think of
29284,joyful,Yea lol Howd you know
29285,joyful,Oh who was there
29286,joyful,Oh sweet Hows the new phone
29287,joyful,The mail man to deliver me my iphone 7 that I ordered
29316,excited,How do you feel
29317,excited,Thats great Hopefully the meeting goes well
29318,excited,Im totally excited
29459,excited,That sounds awesome Have you guys been friends long
29460,excited,Thats pretty cool You guys must have a good relationship 
29461,excited,Yea since we were in diapers practically 
29478,joyful,Nice What kind of food do they serve
29479,joyful,That sounds incredibly tasty I think I will have to go there
29480,joyful,They serve authentic mexican food 
29566,joyful,Thats good to hear Whats going on
29567,joyful,Its good to reunite with them again hu
29568,joyful,I have a meeting this weekend with some old friends that I havent seen in a long time
29572,joyful,Thats a really good idea smart thinking 
29573,joyful,Well hopefully nothing bad will happen and you wont need to use it
29574,joyful,Thank you I sacrificed a lot to save this much
29640,excited,That is nice Do you take them frequently
29641,excited,That is a good surprised
29642,excited,Not very often so theyre gonna be really surprised
29650,joyful,Thats why they are being replaced by machines lol
29651,joyful,I thought I had seen every episode of lock down I havent seen that lol
29652,joyful,i saw an episode of lockdown once where people would go through the drive threw to order there food they did not know it but a call center in prison was taking there orders lol
29677,excited,Whats goin on
29678,excited,That should be fun I have to work this weekend I need to hang with friends before I go crazy
29679,excited,Going to meet some friends I havent seen in a LONG time and probably catch a movie
29693,joyful,Thats how it works for most of us lol
29694,joyful,If only they had told us sooner
29695,joyful,ah lifes beautiful that way lol
29696,joyful,Did you usually visit them
29697,joyful,Thats cool Are you gonna go all out with decorations and things
29698,joyful,I did but we usually met up at other family members houses but this year they chose my house
29796,excited,Would you believe I have never seen one episode of that show How sad that its ending before I even got to watch it
29797,excited,Well dont tell me what happens I might just go watch it all now lol
29798,excited,I am rewatching the last season now I cant wait to see how it ends
29799,excited,Ill just tell you that it is awesome
29878,excited,Those are so much fun Family or school
29879,excited,That will be great Take lots of pictures you will want to remember all of those memories you are going to make
29880,excited,family We a going on a cruise I love cruises
29881,excited,I know My kids will love it too
29891,joyful,Really 
29892,joyful,All of them
29893,joyful,Yes i got all of the flat screen tvs
29896,joyful,What
29897,joyful,Well thats cute
29898,joyful,My girlfriend is what I got for christmas
29899,joyful,5
29956,excited,Yes that can be once of the best times of the week
29957,excited,yes are you going to a fancy restaurant 
29958,excited,We had to cancel the last 3 so this is gonna be special
29959,excited,Yep and then to an art show
29977,joyful,I feel as if dogs think humans are the most comfortable bed
29978,joyful,Yes cuddling is I feel an instinctual joy
29979,joyful,I love when my dogs cuddle with me
30001,joyful,Yes where did you go do you feel relaxed
30002,joyful,Yes I bet it was great probably really nice weather 
30003,joyful,i went to santa fe I felt very relaxed and happy you know It was chill
30052,excited,What was the big day then
30053,excited,Oh cool I hope it goes well
30054,excited,School was starting and this was gonna be my year
30055,joyful,thats pretty cool
30056,joyful,wow thats crazy
30057,joyful,Yes we hung out in our own world the whole time
30067,excited,What did you do with the money
30068,excited,What was it Was it clothing
30069,excited,I bought myself something nice
30234,excited,Will you not be sad to leave him
30235,excited,Thats a good way to be
30236,excited,im more happy to see him grow
30258,excited,What position do you play
30259,excited,Who is your favorite team
30260,excited,I dont I only watch
30261,excited,I have 2  I support Glasgow Rangers But I coown SD Eibar in Spain
30265,excited,i love the becah im there every weekend
30266,excited,i live like 10 min away
30267,excited,Lucky I also love it too especially when the weather is nice like right now not too hot as it has been
30292,excited,Great Why are you so happy today
30293,excited,Brilliant SO the summer starts now for you
30294,excited,because I have just finished my last semester exam 
30328,excited,Well done Did you buy all the parts separately
30329,excited,Did you find it difficult
30330,excited,Yeah  Ive done it a few times and its much easier than most people think Still impressive though
30331,excited,Yes I did buy them all separately  
30332,excited,Actually it was alot easier than I expected  Once you understand the basic functionality in each part the process is becomes less overwhelming  Kind of like putting together a puzzle
30333,excited,Yeah it was impressive to family but to me it was just a another day
30496,excited,I didnt know they still toured I saw Korn years ago
30497,excited,Me too
30498,excited,yes they are still out there listening to them takes me back to the good high schoo days
30585,excited,Why
30586,excited,Cool
30587,excited,I am full of energy as I am starting a new job today
30656,excited,what is Friday
30657,excited,Awww man  You are lucky  That sounds amazing
30658,excited,gonna get chocolate wasted
30678,joyful,Thats good It means you will be on vacation and having fun
30679,joyful,oh ok its good to catch up on old times with foreign friends
30680,joyful,No just going to see them after work one night
30774,excited,congratulations you will be spending time with your loved one again
30775,excited,I hope you can propose marriage to her when you meet with her
30776,excited,Thanks I am so excited to finally be with her again
30786,excited,That sounds like fun
30787,excited,I hope you have a good time
30788,excited,Yes its been a while
30840,joyful,Thats really exciting Do you have any special plans for this weekend
30841,joyful,Well that does sound like a restful and relaxing weekend I love traveling on my off time
30842,joyful,No Im just glad to sleep in lol
30896,excited,Thats great What kind of car did you get
30897,excited,Wow that is a sweet ride
30898,excited,GMC  Denali
30965,excited,Wow I can imagine how joyous that feeling must have been
30966,excited,Congrats That would be really stressful Im happy it all worked out for you
30967,excited,We had been trying for over a year when it happened We thought we would never have another one
30968,excited,Thanks That was 3 years ago now he is a crazy little boy running all over
31064,joyful,Congratulations When is the wedding
31065,joyful,Im happy for you I hope everything continues to work out
31066,joyful,Next year I am so happy
31099,joyful,I feel you Summer is great and all but I miss my classmates and the work Im studying
31100,joyful,I hope you have a successful semester
31101,joyful,Yeah I love the feeling of keeping busy during the school year
31144,excited,What are union memners points
31145,excited,Oh Maybe they should lower the fees or up the rewards
31146,excited,My Fiance is a part of a union for communications workers and they have rewards points you get to redeem for different things The points and perks alone arent worth the union fees in my opinion but he wants to be a part of it so
31147,excited,Sounds fun What movie are you going to watch
31148,excited,Oh Well thats lovely I suppose Lol Maybe you should amend the movie night rules with a different theme every time so they are more constrained to what they have to choose from Haha
31149,excited,I dont know yet Its my daughter turn The kids always pick gun movies
31150,excited,I meant fun movies not gun movies lol
31175,excited,What happens on Saturday
31176,excited,That sounds really cool Have fun
31177,excited,Im going to an MMA show in Louisville  Theres going to be a bunch of awesome fights
31178,excited,Im sure I will  I cant wait
31191,excited,Thats cool  What type of supplements
31192,excited,That sounds pretty healthy  Have you always been this health conscious
31193,excited,Chlorella Bitter Apricot and Wheatgrass All should help me detox get my gut in line and give me some much needed vitamins I can absorb
31194,excited,I wasnt but I have been trying to stay on organic for yearswhen you get older and get health problems and doctors only want to ignore you or prescribe pills and make it worse Its good to research and help yourself
31305,joyful,That sounds like a fine day to me Do you have many birds
31306,joyful,Hah I know how you feel I love to feed birds and watch them outside my house as well
31307,joyful,Oh I meant wild birds and squirrels etc I just think of them as mine 
31308,joyful,yes I cant wait to move to the country and feed even more critters It is one of the most enjoyable things in life to me
31323,excited,is there anything like free cash
31324,excited,i had that nothing good come easily
31325,excited,Nope
31339,excited,That should be fun Where does the cruise go to
31340,excited,The Bahamas is beautiful I am sure you will love it
31341,excited,We are going to the Bahamas I cannot wait It is going to be so fun
31351,joyful,That makes you a queen
31352,joyful,Whats that 
31353,joyful,yes i am a Queen am so excited my husband both a special gift for me after my delivery
31354,joyful,Limo
31361,joyful,Thats great How can you tell you are on the right path
31362,joyful,Congrats Thats awesome
31363,joyful,Because I just paid rent took care of bills tire rotation and still have time to hit the gym 6 days a week and feel like Bruce Wayne
31376,excited,That was nice of him What was it
31377,excited,That is great Were you able to help pick it out
31378,excited,he bought a house for me OMG is an edifice i cant help it am over happy
31395,excited,Sounds exciting
31396,excited,Well I hope you have fun and I hope she does well
31397,excited,I look forward to them every year
31452,excited,Awesome do you plan to go early to try and get autographs
31453,excited,Enjoy yourself if I may refrain from recording it on your phone just be in the moment
31454,excited,I am so pumped up I would love to do that Great idea
31475,excited,Do you have something exciting happening
31476,excited,Thats great  I would be pumped
31477,excited, I get to start my 2 week vacation
31481,joyful,Oh thats really lucky  What happened did someone run a light or something
31482,joyful,That stinks but Im glad hes ok  That must be the scariest thing
31483,joyful,They were texting while riving around a curvy road  I cant believe people dont think they will cause harm while texting and driving  Yes  I dont care about the car Im just so thankful hes safe
31505,excited,Oh I have always wanted to live at the beach I bet you will have a blast
31506,excited,Best part about it is you will never have to leave
31507,excited,I am hoping so  I always love going there on vacation and I hope I feel as relaxed living there as I do when Im on vacation
31508,excited,I know  I love it
31527,joyful,Why do you think that is
31528,joyful,Yes do you ever remember playing in the ocean
31529,joyful,I just remember laughing and running on summer days with my friends
31690,joyful,Thats great At least you found it 
31691,joyful,I would do the same if I had something special like that 
31692,joyful,I know it sounds ridiculous but this stuff is amazing and recycled too so its good for the environment  I did a toilet paper dance in the aisle I was so happy
31707,joyful,Thats great Are you excited about school too
31708,joyful,Ohh wow Well good luck and I hope you have a great time with your friends and school
31709,joyful,Yeah Ill be a junior so Ill be having to really focus and study to get good grades
31807,joyful,Yay  I love the end of the work day  What are you going to do when you get home
31808,joyful,What a perfect way to end the day  Im going to make a big chinese stir fry and watch tv  Have a great night
31809,joyful,Im going to sit on the couch and drink a beer
31810,joyful,You too
31821,joyful,I look forward to the day where I can say the same That must feel liberating
31822,joyful,Wow you must be very financially responsible Im sure thatll help you do well in life Im practicing myself
31823,joyful,It really is I did it early too
31842,excited,Treadmills are great I find that theyre better your knees than running outside
31843,excited,Thats awesome to hear We only get one body we need to take care of it Good luck
31844,excited,Yeah and Im not quite ready for running outside  Im really motivated though to get back in shape
31873,excited,Its always so exciting to take a trip or vacation  but its even more exciting to see family
31874,excited,Haha yea thats how I feel about my In laws  Im glad they are a 4 hour plane ride away
31875,excited,sometimes i look forward to seeing them then when i get there i remember why i live 800 miles away
31876,excited,its terrible to feel that way but lord do they know how to push our buttons right
31965,joyful,I bet that was fun
31966,joyful,Its nice to get a good sweat
31967,joyful,Indeed it was a little hot outside though
31981,excited,oh yippeee what kind of puppy
31982,excited,i bet dogs are amazing we have a big ole mutt who is 75 lbs of lap dog love
31983,excited,A little yellow lab  I think Im looking forward to it more than my kids are
32006,excited,That is so funny but I know exactly how you feel  Sometimes vacations can get too long  Did you leave town
32007,excited,That sounds like a heck of a trip
32008,excited,Yes I took a trip to Hong Kong and Macau I spent a couple days in Seoul but I think Im ready to stop sitting at home and get back to it haha
32072,joyful,Is it all expenses paid
32073,joyful,Well congrats on winning that
32074,joyful,Yes everything is covered including some money for food 
32220,joyful,Are you excited about it
32221,joyful,I hope it goes well
32222,joyful,Yeah absolutely Nervous of course but happy
32288,joyful,That must have been nice  What did they make you
32289,joyful,Very nice  Did you enjoy it
32290,joyful,A omelet and bacon
32294,joyful,Oh lord I am glad you have something that is a healthy hobby
32295,joyful,Thats cool Its always good to have a hobby
32296,joyful,Me too it is a big part of my time watching games and tape
32313,excited,Connecting with the people that mattered the most makes me super excited
32314,excited,Parents are so important It is good that you reconnected with them
32315,excited,Oh I bet that is going to be fun
32316,excited,I hope you have fun then
32317,excited,Yea I cant wait I have really been looking forward to it
32318,excited,Very nice The weather should be perfect
32319,excited,Drink a few beers and have a hotdog for me Should be fun
32320,excited,I hope it is
32358,excited,Why is that
32359,excited,That should be a fun time hope you stay safe
32360,excited,I am going to my best friends beach house
32367,excited,I saw that I cant wait to play
32368,excited,Yes I was astounded how good it looks didnt expect it to be like that
32369,excited,Me neither they are doing this game right for the fans I am pumped
32397,excited,Nice i just picked up the new madden so i will be gaming all weekend as well
32398,excited,it is really good they fixed alot of things from last year to make it awesome
32399,excited,Oh man I want to play that too
32469,excited,It is amazing For how long have you been playing this game
32470,excited,I played a lot of video games when I was kid I liked that so much
32471,excited,Since Brawl played a bit of Melee as a kid too
32484,joyful,Nice when does the new game come out Or is it already out haha
32485,joyful,I dont know much about video games but remember playing Mario and games on a Nintendo 64
32486,joyful,It comes out in December they are showing stuff about it like yesterday
32500,excited,Whats coming out
32501,excited,Theres way too many Pokemon these days
32502,excited,Super Smash Bros Pokemon and Mario Party
32512,excited,How did that go
32513,excited,Good I have never been to one at all
32514,excited,It was very thrilling experience and I enjoyed a lot
32527,joyful,thats wonderful Im happy for you 
32528,joyful,thank you I hope you will have a great rest of your night
32529,joyful,Thank you I wish the same for you
32551,excited,I heard its suppose to be good more modern but like the classic also
32552,excited,It comes out in December right It would make a good holiday present
32553,excited,It is certainly the ultimate version of the game it looks amazing
32566,joyful,Oh wow was it good
32567,joyful,What kind of cake
32568,joyful,Yes Its delicious Now I just need to figure out how to save this thing
32623,excited,Well that sounds like fun Its definitely much better without the rain 
32624,excited,Yes they are such a nuisance Bring some bug spray for sure And watch out for food hunting critters
32625,excited,Hopefully not as many mosquitos too
32639,joyful,Thats awesome Was it a surprise for you as well
32640,joyful,Im happy for you
32641,joyful,yea i wasnt expecting it
32679,joyful,Thats awesome Do you have anything special planned
32680,joyful,That sounds like a nice relaxing was to spend your day I hope you enjoy it
32681,joyful,probably go to the movies and then dinner
32691,joyful,that sounds wonderful
32692,joyful,Im the same way The wanting never ends really
32693,joyful,yes i feel like people always want more bigger house better car more money but im happy right where i an
32842,excited,What is the game
32843,excited,Nice Have fun
32844,excited,There will be lots Not sure which one I wanna watch yet
32894,excited,YAAAAAYYYY
32895,excited,cool how long have yo ubeen teaching
32896,excited,thats a long time You should be used to it
32897,excited,I am teaching at a new school so its scary and new
32898,excited,bout ten years
32928,excited,Oh I feel the exact opposite lol What are you looking forward too
32929,excited,OHH That would be wonderful Sleeping in is the best when you can do it
32930,excited,not having to wake up at 4am to go to work
32971,excited,wow where are you going
32972,excited,I can imagine how excited you are  Are you visiting anyone or just going to go see the sights
32973,excited,i am going to amsterdam
32997,excited,what are you going to get
32998,excited,that sounds like a good plan
32999,excited,Everything in Macys lol I havent been shopping in so long
33000,excited,ITs a terrible plan but Im gonna do it anyway
33010,excited,big plans
33011,excited,I wish I could go and chillax anywhere
33012,excited,gonna go to the coast and chillax
33032,joyful,What will you be doing this weekend
33033,joyful,Dont club any seals 
33034,joyful,clubbin
33110,excited,happy early birthday
33111,excited,ARe you going to have a party
33112,excited,Thank you I am so excited for all the gifts
33145,joyful,Nice What are you planning on doing
33146,joyful,Sounds like the ultimate plan to me I think I will do the same
33147,joyful,No plans yet Im just happy to sleep in
33241,joyful,Is there some good news
33242,joyful,That is such a heartwarming story
33243,joyful,Yes  After four years of lots of intervention we got pregnant without any help She turned 18 this year
33301,joyful,Oh wow Congratulations How much did you pay for the ticket
33302,joyful,Oh wow I bet youll have that 99 in no time so you can buy another Good job
33303,joyful,Thanks I was so happy I paid a hundred bucks for the ticket Just 99 more and Ill be able to buy another
33335,excited,Wow how exciting  Its been a long time since Ive had a birthday party  are you going anywhere special
33336,excited,OOOO I love gifts  I know its never about the gift but ok it is SO nice to get presents
33337,excited,Nope But I am having all my friends over Cant wait to see the cool gifts they got me
33350,excited,Oh cool Where are you guys going
33351,excited,That sounds like fun Beach days are the best days
33352,excited,Were driving a few hours away to the beach
33436,excited,I love fried twinkies you will too
33437,excited,I am so excited for you
